KODAS;PAVADINIMAS;GALIOJA;SUMINE;SUKURIMO_DATA;MODIFIKAVIMO_DATA
5B01090;"FS-05-PR-13010203, Vilniaus miesto plėtros teritorijų detaliųjų planų koncepcijos (tikslas - funkcinio zonavimo, inžinerinių tinklų, transporto infrastruktūros koridorių nustaymas) ir kiti projektai";Y;Y;23-JUL-09;23-JUL-09
5B01091;"FS-01-PR-13010203, Vilniaus miesto plėtros teritorijų detaliųjų planų koncepcijos (tikslas - funkcinio zonavimo, inžinerinių tinklų, transporto infrastruktūros koridorių nustatymas) ir kiti projektai";Y;Y;23-JUL-09;23-JUL-09
5B01121;"FS-01-PR-13010206, Lukiškių aikštės plėtros koncepcijos parengimas, suplanavimas ir simbolio ""Laisvė"" sukūrimo architektūrinis-meninis konkursas";Y;Y;23-JUL-09;23-JUL-09
5B01122;"FS-01-PR-13010216 Projektas ""B-TEAM"" pagal INTERREG IVC programą";Y;Y;01-FEB-10;01-FEB-10
5B01131;"FS-01-PR-13010207, Vilniaus miesto medinių pastatų planavimo darbai";Y;Y;23-JUL-09;23-JUL-09
5B01170;"FS-05-PR-13010211, Specialieji paveldosauginiai Šnipiškių, Žvėryno ir Naujamiesčio kultūrinių draustinių planai";Y;Y;23-JUL-09;23-JUL-09
6000000;"Socialinių reikalų departamento sąmatos";Y;Y;20-NOV-07;14-MAR-08
6000010;"Viešųjų darbų organizavimas Socialinės paramos centre";Y;N;20-NOV-07;01-MAR-12
6000020;"Viešųjų darbų organizavimas Fabijoniškių pensione";Y;N;20-NOV-07;01-MAR-12
6000030;"Viešųjų darbų organizavimas Vilniaus miesto vaikų pensione";Y;N;20-NOV-07;01-MAR-12
6000050;"Viešųjų darbų organizavimas kitose socialinių paslaugų įstaigose (Departamentas)";Y;N;20-NOV-07;14-MAR-08
6000060;"Socialinė globa asmenims su sunkia negalia (Departamentas)";Y;N;20-NOV-07;27-DEC-19
6000061;"Gyventojų užimtumo programų finansavimas";Y;N;09-JUN-17;09-JUN-17
6000070;"Socialinė globa asmenims su sunkia negalia Vilniaus miesto vaikų pensione";Y;N;20-NOV-07;13-JAN-21
6000075;"MMA didinimui ir darbo apmokėjimo įstatymui įgyvendinti";Y;N;26-SEP-16;02-JUN-17
6000076;"Socialinių paslaugų srities darbuotojų minimaliesiems pareiginės algos pastoviosios dalies koeficientams didinti";Y;N;31-MAR-22;31-MAR-22
6000080;"Socialinė globa asmenims su sunkia negalia pensionate ""Vilties namai""";Y;N;20-NOV-07;20-SEP-13
6000087;"Socialinė globa asmenims su sunkia negalia ugdymo centre „Viltis“";Y;N;31-DEC-19;31-DEC-19
6000088;"Socialinė globa asmenims su vidutine negalia ugdymo centre „Viltis“";Y;N;09-DEC-19;02-JUL-21
6000089;"Socialinė globa asmenims su sunkia negalia Verkių specialiojoje mokykloje-daugiafunkciniame centre";Y;N;09-DEC-19;09-DEC-19
6000090;"Socialinė globa asmenims su sunkia negalia Fabijoniškių pensione";Y;N;20-NOV-07;27-DEC-19
6000091;"Socialinė globa asmenims su sunkia negalia Dienos centre ""Šviesa""";Y;N;14-MAR-08;27-MAR-09
6000092;"Socialinė globa asmenims su sunkia negalia namuose";Y;N;28-OCT-11;28-OCT-11
6000093;"Socialinė globa asmenims su sunkia negalia Verkių specialiojoje mokykloje-daugiafunkciniame centre";Y;N;01-FEB-19;01-FEB-19
6000094;"Socialinė globa asmenims su vidutine negalia specialiajame lopšelyje-darželyje „Čiauškutis“ (SB)";Y;N;01-FEB-19;01-FEB-19
6000095;"Socialinė globa asmenims su sunkia negalia specialiajame lopšelyje-darželyje „Čiauškutis“";Y;N;01-FEB-19;01-FEB-19
6000096;"Socialinė globa asmenims su sunkia negalia ugdymo centre „Viltis“";Y;N;01-FEB-19;01-FEB-19
6000097;"Socialinių paslaugų teikimo infrastruktūros optimizavimas, socialinių paslaugų įstaigų padalinių steigimas";Y;N;01-FEB-19;27-DEC-19
6000098;"Kompleksinės paslaugos šeimai Vilniaus mieste (ES) lėšų likučiai";Y;N;11-FEB-19;27-DEC-19
6000099;"VšĮ Vilniaus miesto klinikinės ligoninės operacinių, reanimacijos ir hemodializės bloko Antakalnio g. 57, Vilniuje, statyba ir įrengimas (SB)";Y;N;11-FEB-19;11-FEB-19
6000100;"Laidojimo pašalpos mirusiojo artimiesiems (Socialinės paramos centras)";Y;N;20-NOV-07;27-DEC-19
6000101;"Tikslinės lėšos Verkių specialiojoje mokykloje-daugiafunkcinio centro dienos socialinės globos skyriaus išlaikymui";Y;N;28-MAY-20;28-MAY-20
6000102;"Vilniaus miesto bendruomeninių vaikų globos namų tinklo plėtra (ES) (BVGN1)";Y;N;13-OCT-20;13-OCT-20
6000103;"Vilniaus miesto bendruomeninių vaikų globos namų tinklo plėtra (ES) (BVGN2)";Y;N;13-OCT-20;13-OCT-20
6000110;"Socialinės priežiūros socialinės rizikos šeimoms finansavimas iš specialių tikslinių dotacijų (Socialinės paramos centras)";Y;N;20-NOV-07;27-DEC-19
6000111;"Nevyriausybinių organizacijų darbas su socialinės rizikos šeimomis";Y;N;16-SEP-14;27-DEC-19
6000112;"Vilniaus miesto bendruomeninių vaikų globos namų tinklo plėtra (ES)";Y;N;25-JAN-21;25-JAN-21
6000113;"Nefrologinių ligonių pavėžėjimo bei apgyvendinimo savarankiško gyvenimo namuose paslaugos";Y;N;18-JAN-22;18-JAN-22
6000114;"Viešojo transporto bilietai Vilniaus miesto socialinių paslaugų įstaigų darbuotojams";Y;N;18-JAN-22;18-JAN-22
6000115;"Asmeninės pagalbos teikimas";Y;N;19-JUL-21;19-JUL-21
6000116;"Asmeninės pagalbos teikimo administravimas (SPC)";Y;N;19-JUL-21;19-JUL-21
6000117;"Institucinė globa užsieniečiams socialinės globos įstaigose";Y;N;03-JUN-22;03-JUN-22
6000118;"Asmeninės pagalbos teikimas";Y;N;26-JAN-22;26-JAN-22
6000119;"Asmeninės pagalbos teikimo administravimas (SPC)";Y;N;26-JAN-22;26-JAN-22
6000120;"Socialinės pašalpos ir kompensacijos socialiai pažeidžiamiems asmenims (Departamentas)";Y;N;20-NOV-07;27-DEC-19
6000121;"Kompensacijos už išlaidas būstui šildyti (Departamentas)";Y;N;20-JAN-10;29-JAN-10
6000122;"Kompensacijos už išlaidas karštam vandeniui (Departamentas)";Y;N;20-JAN-10;29-JAN-10
6000123;"Kompensacijos už išlaidas šaltam vandeniui (Departamentas)";Y;N;29-JAN-10;29-JAN-10
6000124;"Kredito, paimto daugiabučiam namui atnaujinti (modernizuoti) ir palūkanų apmokėjimo už asmenis, turinčius teisę į būsto šildymo išlaidų kompensaciją (Departamentas)";Y;N;26-APR-10;26-APR-10
6000125;"Vilniaus vaikų dienos centrų tinklo plėtra (VB)";Y;N;29-JUL-22;29-JUL-22
6000130;"Socialinių išmokų bei kompensacijų administravimas (Departamentas)";Y;N;20-NOV-07;27-DEC-19
6000131;"Socialinių pašalpų bei kompensacijų administravimas iš savivaldybės lėšų";Y;N;08-SEP-10;27-DEC-19
6000140;"Socialinių išmokų bei kompensacijų administravimas (Socialinės paramos centras)";Y;N;20-NOV-07;14-MAR-08
6000141;"Vilniaus Žolyno vaikų socialinės globos namų išlaikymas";Y;N;05-JAN-11;01-MAR-12
6000142;"Vilniaus Minties vaikų socialinės globos namų išlaikymas";Y;N;06-JAN-11;01-MAR-12
6000143;"Vilniaus Antakalnio vaikų socialinės globos namų išlaikymas";Y;N;06-JAN-11;27-DEC-19
6000144;"Vilniaus vaikų socialinės globos namų „Gilė“ išlaikymas";Y;N;06-JAN-11;01-MAR-12
6000145;"VšĮ „Antavilių pensionatas“ finansavimas";Y;N;06-JAN-11;06-JAN-11
6000146;"Piniginės pašalpos socialiai pažeidžiamiems asmenims (SPC)";Y;N;28-MAY-20;28-MAY-20
6000148;"Neįgaliųjų socialinė integracija, pritaikant gyvenamąją aplinką";Y;N;04-DEC-18;27-DEC-19
6000149;"Neįgaliųjų socialinė integracija";Y;N;26-FEB-16;10-FEB-20
6000150;"Vienkartinė parama bei socialinės pašalpos išimties tvarka socialiai pažeidžiamiems asmenims (Departamentas)";Y;N;20-NOV-07;27-DEC-19
6000151;"Socialinės pašalpos socialiai pažeidžiamiems asmenims (savivaldybės biudžetas)";Y;N;02-JAN-14;27-DEC-19
6000152;"Skolų mokėjimas pagal 2013-03-05 tarpusavio atsiskaitymų sutartį Nr. 29-49(1.2.16-AD4) UAB „Vilniaus vandenys“ (Departamentas)";Y;N;24-JAN-14;24-JAN-14
6000153;"Laidojimo pašalpos mirusiojo, nedeklaravusio gyvenamosios vietos Lietuvos respublikoje, artimiesiems (Socialinių reikalų ir sveikatos departamentas)";Y;N;01-AUG-14;01-AUG-14
6000154;"Kompensacijos už išlaidas būstui šildyti (Departamentas)";Y;N;22-JAN-15;22-JAN-15
6000155;"Kompensacijos už išlaidas karštam vandeniui";Y;N;22-JAN-15;27-DEC-19
6000156;"Kompensacijos už išlaidas šaltam vandeniui";Y;N;22-JAN-15;27-DEC-19
6000157;"Kredito, paimto daugiabučiam namui atnaujinti (modernizuoti) ir palūkanų apmokėjimo už asmenis, turinčius teisę į būsto šildymo išlaidų kompensaciją";Y;N;22-JAN-15;27-DEC-19
6000160;"Piniginės pašalpos socialiai pažeidžiamiems asmenims (Socialinės paramos centras)";Y;N;20-NOV-07;27-DEC-19
6000161;"Papildoma piniginė socialinė parama (papildoma dotacija iš valstybės biudžeto)";Y;N;13-AUG-20;01-SEP-20
6000162;"Socialinės pašalpos socialiai pažeidžiamiems asmenims (papildoma dotacija iš valstybės biudžeto)";Y;N;24-AUG-20;24-AUG-20
6000163;"Kompensacijos už išlaidas būstui šildyti (papildoma dotacija iš valstybės biudžeto)";Y;N;28-OCT-20;28-OCT-20
6000164;"Papildoma piniginė socialinė parama";Y;N;01-DEC-20;01-DEC-20
6000165;"Kredito, paimto daugiabučiam namui atnaujinti (modernizuoti) ir palūkanų apmokėjimo už asmenis, turinčius teisę į būsto šildymo išlaidų kompensaciją  (papildoma dotacija iš valstybės biudžeto)";Y;N;16-DEC-20;16-DEC-20
6000170;"Vienkartinė parama socialiai pažeidžiamiems asmenims (Administracijos direktoriaus rezervas)";Y;N;20-NOV-07;07-MAY-09
6000171;"Administracijos direktoriaus 2009-05-08 įsakymas Nr. 30-809 (vienkartinė parama)";Y;N;14-MAY-09;14-MAY-09
6000172;"Administracijos direktoriaus 2009-07-10 d. įsakymas Nr. 30-1221 (Vienkartinė parama)";Y;N;14-JUL-09;14-JUL-09
6000180;"LR finansų ministerijos tarpusavio atsiskaitymai dėl vienkartinių kompensacijų asmenims, patyrusiems žalą likviduojant Černobylio atominės elektrinės avarijos padarinius";Y;N;20-NOV-07;14-MAR-08
6000190;"LR finansų ministerijos tarpusavio atsiskaitymai dėl kompensacijos savivaldybei išmokėtos sumos - suteiktos valstybės finansinės paramos užsienyje mirusių (žuvusių) LR piliečių palaikams parvežti į Lietuvos Respubliką";Y;N;20-NOV-07;20-MAR-09
6000192;"MMA didinimui";Y;N;30-SEP-15;30-SEP-15
6000193;"Vaikų globos pertvarka";Y;N;26-FEB-16;26-FEB-16
6000194;" Vilniaus miesto vaikų dienos centrų tinklo plėtra (ES)";Y;N;15-SEP-20;15-SEP-20
6000195;"Kompensacijos už išlaidas būstui šildyti socialiai pažeidžiamiems asmenims (Tarpusavio atsiskaitymai, LRV 2011-10-19 nutarimas Nr. 1207)";Y;N;04-NOV-11;04-NOV-11
6000196;"Kompensacijos už išlaidas karštam vandeniui socialiai pažeidžiamiems asmenims (Tarpusavio atsiskaitymai, LRV 2011-10-19 nutarimas Nr. 1207)";Y;N;04-NOV-11;04-NOV-11
6000197;"Kompensacijos socialinėms pašalpoms socialiai pažeidžiamiems asmenims (Tarpusavio atsiskaitymai, LRV 2011-10-19 nutarimas Nr. 1207)";Y;N;04-NOV-11;04-NOV-11
6000198;"Kompensacijos socialinėms pašalpoms socialiai pažeidžiamiems asmenims (Tarpusavio atsiskaitymai, LRV 2011-10-12 nutarimas Nr. 1200 )";Y;N;21-OCT-11;21-OCT-11
6000199;"Kompensacijos socialinėms pašalpoms socialiai pažeidžiamiems asmenims (Tarpusavio atsiskaitymai, LRV 2011-08-17 nutarimas Nr. 960)";Y;N;19-AUG-11;23-AUG-11
6000200;"LR finansų ministerijos tarpusavio atsiskaitymai dėl gaisro ir kitos stichinės nelaimės metu padarytiems nuostoliams iš dalies padengti";Y;N;20-NOV-07;25-MAR-09
6000201;"LRV Finansų ministerijos tarpusavio atsiskaitymai dėl gaisro  ir  kitos  stichinės  nelaimės  metu padarytiems nuostoliams   iš   dalies   padengti  (LRV   2010-12-15 nutarimas Nr. 1788)";Y;N;23-DEC-10;23-DEC-10
6000203;"Vienkartinė išmoka vaikui pandemijos padariniams mažinti (1.1.1.1.5)";Y;N;21-JUL-20;21-JUL-20
6000204;"Vienkartinė išmoka vaikui pandemijos padariniams mažinti (1.1.1.1.1)";Y;N;21-JUL-20;21-JUL-20
6000205;"Kompensacijos socialinėms pašalpoms socialiai pažeidžiamiems asmenims(tarpusavio atsiskaitymai-LRV 2010-11-22  nutarimas Nr.1651)";Y;N;24-NOV-10;24-NOV-10
6000206;"Kompensacijos už išlaidas būstui šildyti socialiai pažeidžiamiems asmenims (tarpusavio atsiskaitymai – LRV 2010-11-22  nutarimas Nr.1651)";Y;N;24-NOV-10;24-NOV-10
6000207;"Kompensacijos už išlaidas karštam vandeniui socialiai pažeidžiamiems asmenims (tarpusavio atsiskaitymai -LRV 2010-11-22 nutarimas Nr. 1651)";Y;N;24-NOV-10;24-NOV-10
6000208;"Kompensacijos už išlaidas šaltam vandeniui socialiai pažeidžiamiems asmenims (tarpusavio atsiskaitymai –LRV 2010-11-22   nutarimas Nr.1651)";Y;N;24-NOV-10;24-NOV-10
6000209;"Socialinių išmokų  ir kompensacijų administravimas (tarpusavio atsiskaitymai –LRV 2010-11-22 nutarimas Nr.1651) Departamentas";Y;N;24-NOV-10;18-JAN-11
6000210;"LR finansų ministerijos tarpusavio atsiskaitymai dėl kitų išmokų";Y;N;20-NOV-07;22-SEP-10
6000211;"LR finansų ministerijos tarpusavio atsiskaitymai socialinėms pašalpoms ir kompensacijoms mokėti socialiai pažeidžiamiems asmenims. (LRV 2009-08-19 nutarimas Nr. 863)";Y;N;03-SEP-09;03-SEP-09
6000212;"LR finansų ministerijos tarpusavio atsiskaitymai socialinėms pašalpoms ir kompensacijoms mokėti socialiai pažeidžiamiems asmenims (LR Vyriausybės 2009-10-28 d. nutarimas Nr. 1383)";Y;N;11-NOV-09;11-NOV-09
6000213;"Kompensacijos socialinėms pašalpoms socialiai pažeidžiamiems asmenims (tarpusavio atsiskaitymai LRV 2010-06-02 nutarimas Nr. 667)";Y;N;11-JUN-10;12-AUG-10
6000214;"Kompensacijos už išlaidas būstui šildyti socialiai pažeidžiamiems asmenims (tarpusavio atsiskaitymai LRV 2010-06-02 nutarimas Nr. 667)";Y;N;11-JUN-10;11-JUN-10
6000215;"Socialinių išmokų ir kompensacijų administravimas (Socialinės paramos centras - tarpusavio atsiskaitymai)";Y;N;02-JUL-10;02-JUL-10
6000216;"Socialinės pašalpos ir kompensacijos socialiai pažeidžiamiems asmenims (Departamentas)";Y;N;06-AUG-10;02-FEB-15
6000217;"Kompensacijos socialinėms pašalpoms socialiai pažeidžiamiems asmenims (tarpusavio atsiskaitymai –LRV 2010-08-31 nutarimas Nr.1254)";Y;N;17-SEP-10;29-SEP-10
6000218;"Kompensacijos už išlaidas būstui šildyti socialiai pažeidžiamiems asmenims (tarpusavio atsiskaitymai-LRV 2010-08-31 nutarimas Nr.1254)";Y;N;17-SEP-10;17-SEP-10
6000219;"Socialinių išmokų  ir kompensacijų administravimas (Socialinės paramos centras) (tarpusavio atsiskaitymai – LRV 2010-08-31 nutarimas Nr.1254)";Y;N;17-SEP-10;22-SEP-10
6000220;"Išmokos vaikams";Y;N;20-NOV-07;14-MAR-08
6000221;"Išmokos vaikams mokėti";Y;N;06-JAN-10;14-JAN-14
6000222;"Išmokos privalomosios tarnybos karių vaikams";Y;N;06-JAN-10;06-JAN-10
6000223;"Vienkartinės išmokos nėščioms moterims";Y;N;06-JAN-10;06-JAN-10
6000224;"Globos (rūpybos) išmokos";Y;N;06-JAN-10;06-JAN-10
6000225;"Vienkartinės išmokos įsikurti";Y;N;06-JAN-10;06-JAN-10
6000226;"Transporto išlaidų bei specialiųjų lengvųjų automobilių įsigijimo išlaidų kompensacijos";Y;N;06-JAN-10;06-JAN-10
6000227;"Globos išmokos tikslinis priedas (Valstybės biudžetas)";Y;N;11-JAN-13;11-JAN-13
6000228;"Vilniaus miesto savivaldybės vykdomi bendradarbiavimo projektai";Y;N;02-JAN-19;27-DEC-19
6000229;"Vilniaus miesto savivaldybės vykdomi bendradarbiavimo projektai (kitos lėšos)";Y;N;02-JAN-19;02-JAN-19
6000230;"Išmokų vaikams administravimas (Socialinės paramos centras)";Y;N;20-NOV-07;14-MAR-08
6000231;"Globos (rūpybos) išmokai ir globos (rūpybos) išmokos tiksliniam priedui padidintai daliai mokėti";Y;N;04-MAR-22;04-MAR-22
6000240;"Išmokų vaikams administravimas (Departamentas)";Y;N;20-NOV-07;27-DEC-19
6000245;"Socialinės globos paslaugos vaikams institucijose";Y;N;15-JAN-21;15-JAN-21
6000246;"Socialinės paslaugos";Y;N;15-JAN-21;15-JAN-21
6000247;"Kompleksinės paslaugos šeimai Vilniaus mieste (SPS) (VB)";Y;N;15-JAN-21;15-JAN-21
6000250;"Šalpos išmokos";Y;N;20-NOV-07;27-DEC-19
6000251;"Tikslinių kompensacijų dalinis kompensavimas";Y;N;28-JUL-20;28-JUL-20
6000260;"Šalpos išmokų administravimas (Socialinės paramos centras)";Y;N;20-NOV-07;14-MAR-08
6000270;"Šalpos išmokų administravimas (Departamentas)";Y;N;20-NOV-07;27-DEC-19
6000280;"Transporto išlaidų kompensacijos neįgaliesiems";Y;N;20-NOV-07;14-MAR-08
6000290;"Išmokos neįgaliesiems (Neįgaliųjų reikalų departamento prie SADM lėšos)";Y;N;20-NOV-07;14-MAR-08
6000291;"Išmokos neįgaliesiems (Neįgaliųjų reikalų departamento prie SADM dotacija)";Y;N;26-JAN-22;26-JAN-22
6000292;"Parama užsieniečiams (vienkartinė išmoka įsikurti, kompensacija už vaikų ugdymą) dotacija iš valstybės biudžeto";Y;N;04-MAY-22;04-MAY-22
6000300;"Vienkartinės pašalpos ginkluoto pasipriešinimo (rezistencijos) dalyviams ir žuvusių rezistentų šeimoms";Y;N;20-NOV-07;30-MAR-09
6000310;"Vienkartinių pašalpų ginkluoto pasipriešinimo (rezistencijos) dalyviams ir žuvusių rezistentų šeimoms administravimas";Y;N;20-NOV-07;27-MAR-09
6000320;"Vienkartinės kompensacijos asmenims, sužalotiems atliekant būtinąją karinę tarnybą sovietinėje armijoje ir žuvusiųjų šeimoms";Y;N;20-NOV-07;27-MAR-09
6000330;"Vienkartinių kompensacijų asmenims, sužalotiems atliekant būtinąją karinę tarnybą sovietinėje armijoje ir žuvusiųjų šeimoms administravimas";Y;N;20-NOV-07;27-MAR-09
6000340;"Kompensacijos už komunalines paslaugas privalomosios pradinės karo tarnybos kariams";Y;N;20-NOV-07;30-MAR-09
6000350;"Kompensacijų už komunalines paslaugas privalomosios pradinės karo tarnybos kariams administravimas";Y;N;20-NOV-07;27-MAR-09
6000360;"Parama integracijai užsieniečiams, gavusiems prieglobstį";Y;N;20-NOV-07;14-MAR-08
6000370;"Paramos integracijai užsieniečiams, gavusiems prieglobstį, administravimas (Socialinės paramos centras)";Y;N;20-NOV-07;14-MAR-08
6000380;"Paramos integracijai užsieniečiams, gavusiems prieglobstį, administravimas (Departamentas)";Y;N;20-NOV-07;27-SEP-12
6000381;"Skaitmeninės televizijos priėmimo įrangai įsigyti, kompensavimo mažas pajamas gaunantiems bendrai  gyvenantiems asmenims ir vieniems gyvenantiems asmenims administravimas  (LRV 2010-01-20 nutarimas Nr. 81)";Y;N;27-SEP-12;27-SEP-12
6000389;"Dienos centro „Šviesa“ COVID-19 išlaidų padengimas (01)";Y;N;19-FEB-21;19-FEB-21
6000390;"Dienos centro ""Šviesa"" išlaikymas (Savivaldybės lėšos)";Y;N;20-NOV-07;27-DEC-19
6000391;"Tikslinės lėšos Vilties specialiosios mokyklos-daugiafunkcinio centro dienos socialinės globos skyriaus išlaikymui";Y;N;19-MAY-20;28-MAY-20
6000398;"Tikslinės lėšos Vilniaus Lakštingalos namų profsąjungos narių darbo užmokesčiui";Y;N;19-FEB-21;19-FEB-21
6000399;"Tikslinės lėšos Vilniaus Lakštingalos namų išlaikymui";Y;N;19-MAY-20;04-FEB-21
6000400;"Vilniaus miesto vaikų pensiono išlaikymas (Savivaldybės lėšos)";Y;N;20-NOV-07;13-JAN-21
6000401;"Globos namų vaikams ir jaunimui, turintiems negalią, modernizavimas";Y;N;17-FEB-12;17-FEB-12
6000402;"Socialinės paramos įstaigų infrastruktūros modernizavimas, optimizavimas ir renovacija";Y;N;02-NOV-18;27-DEC-19
6000403;"Darbo apmokėjimo įstatymui įgyvendinti ir įstaigų komunalinėms išlaidoms padengti";Y;N;02-JUL-21;20-JAN-22
6000404;"MMA didinimui ir darbo apmokėjimo įstatymui įgyvendinti";Y;N;02-JUL-21;02-JUL-21
6000405;"VšĮ „Senevita“ COVID-19 išlaidų padengimas";Y;N;02-APR-21;02-APR-21
6000408;"Valakampių socialinių paslaugų namų  COVID-19 išlaidų padengimas (01)";Y;N;19-FEB-21;19-FEB-21
6000409;"Tikslinės lėšos Valakampių socialinių paslaugų namų išlaikymui";Y;N;19-MAY-20;19-MAY-20
6000410;"Pensionato ""Vilties namai"" išlaikymas (Savivaldybės lėšos)";Y;N;20-NOV-07;27-DEC-19
6000411;"Biudžetinės įstaigos Valakampių socialinių paslaugų namų savarankiško gyvenimo namų ir trumpalaikės globos centro įkūrimas (Savivaldybės biudžeto lėšos)";Y;N;06-JAN-11;20-SEP-13
6000412;"Biudžetinės įstaigos Valakampių socialinių paslaugų namų grupiniai gyvenimo namai (Savivaldybės biudžeto lėšos)";Y;N;17-FEB-12;20-SEP-13
6000420;"Fabijoniškių pensiono išlaikymas (Savivaldybės lėšos)";Y;N;20-NOV-07;27-DEC-19
6000421;"Tikslinės lėšos Fabijoniškių socialinių paslaugų namų išlaikymui";Y;N;19-MAY-20;19-MAY-20
6000422;"Fabijoniškių socialinių paslaugų namų COVID-19 išlaidų padengimas (01)";Y;N;19-FEB-21;19-FEB-21
6000430;"Vilniaus miesto motinos ir vaiko pensiono išlaikymas (Savivaldybės lėšos)";Y;N;20-NOV-07;27-DEC-19
6000431;"Grupinio gyvenimo namų vaikams, krizių tarnybos ir laikino  apgyvendinimo namų motinoms ir vaikams įkūrimas (Savivaldybės biudžeto lėšos)";Y;N;06-JAN-11;06-JAN-11
6000432;"Tikslinės lėšos Vilniaus miesto krizių centro išlaikymui";Y;N;19-MAY-20;19-MAY-20
6000433;"Vilniaus miesto krizių centro COVID-19 išlaidų padengimas (01)";Y;N;19-FEB-21;19-FEB-21
6000440;"Vilniaus miesto nakvynės namų išlaikymas (Savivaldybės lėšos)";Y;N;20-NOV-07;02-JUL-21
6000441;"Tikslinės lėšos Vilniaus miesto nakvynės namų išlaikymui";Y;N;19-MAY-20;19-MAY-20
6000442;"Vilniaus „Vilko pėdos“ namų COVID-19 išlaidų padengimas (01)";Y;N;19-FEB-21;02-JUL-21
6000450;"Kitos bendros valstybės paslaugos (Socialinės paramos centras)";Y;N;20-NOV-07;14-MAR-08
6000460;"Socialinės paramos centro Paslaugų namuose tarnybos išlaikymas";Y;N;20-NOV-07;01-MAR-12
6000461;"Tikslinės lėšos Socialinės paramos centro Paslaugų namuose tarnybos išlaikymui";Y;N;28-MAY-20;28-MAY-20
6000462;"Vilniaus miesto socialinės paramos centro Paslaugų namuose tarnybos COVID-19 išlaidų padengimas (01)";Y;N;19-FEB-21;19-FEB-21
6000463;"MMA didinimui ir darbo apmokėjimo įstatymui įgyvendinti";Y;N;02-JUL-21;02-JUL-21
6000465;"Dienos centro „Bičiulis“ finansavimas";Y;N;27-JAN-21;27-JAN-21
6000466;"Dienos centro „Labirintai“ finansavimas";Y;N;27-JAN-21;27-JAN-21
6000467;"Tikslinės lėšos Vilniaus miesto socialinės paramos centro Paslaugų namuose tarnybos profsąjungos narių darbo užmokesčiui";Y;N;22-MAR-21;22-MAR-21
6000468;"Tikslinės lėšos Vilniaus miesto socialinės paramos centro profsąjungos narių darbo užmokesčiui";Y;N;22-MAR-21;22-MAR-21
6000469;"Vilniaus miesto socialinės paramos centro COVID-19 išlaidų padengimas (01)";Y;N;19-FEB-21;19-FEB-21
6000470;"Socialinės paramos centro išlaikymas (Savivaldybės lėšos)";Y;N;20-NOV-07;27-DEC-19
6000471;"Socialinės priežiūros socialinės rizikos šeimoms finansavimas iš savivaldybės lėšų (Socialinės paramos centras)";Y;N;14-MAR-08;14-MAR-08
6000472;"Socialinių išmokų bei kompensacijų administravimas (Socialinės paramos centras)";Y;N;17-DEC-10;17-DEC-10
6000473;"Savarankiško gyvenimo  namų „Savi namai“ ir dienos centro psichikos negalią  turintiems asmenims įkūrimas (Savivaldybės biudžeto lėšos)";Y;N;06-JAN-11;28-OCT-11
6000474;"Gerovės konsultantų modelio įdiegimas Vilniaus mieste";Y;N;12-JAN-22;12-JAN-22
6000480;"Dienos centro ""Šviesa"" išlaikymas (Tarpusavio atsiskaitymai)";Y;N;20-NOV-07;27-DEC-19
6000481;"Tikslinės lėšos Vilniaus Žolyno vaikų socialinės globos namų išlaikymui";Y;N;19-MAY-20;19-MAY-20
6000482;"Vilniaus Žolyno vaikų socialinės globos namų COVID-19 išlaidų padengimas (01)";Y;N;19-FEB-21;19-FEB-21
6000485;"MMA didinimui ir darbo apmokėjimo įstatymui įgyvendinti";Y;N;26-SEP-16;02-JUN-17
6000490;"Vilniaus miesto vaikų pensiono išlaikymas (Tarpusavio atsiskaitymai)";Y;N;20-NOV-07;01-MAR-12
6000500;"Pensionato ""Vilties namai"" išlaikymas (Tarpusavio atsiskaitymai)";Y;N;20-NOV-07;27-DEC-19
6000501;"MMA didinimui ir darbo apmokėjimo įstatymui įgyvendinti";Y;N;26-OCT-15;02-JUN-17
6000502;"Tikslinės lėšos Socialinės paramos centro išlaikymui";Y;N;19-MAY-20;19-MAY-20
6000503;"Projekto „Socialinės paramos prieinamumo didinimas“ įgyvendinimas SPC";Y;N;28-MAY-20;28-MAY-20
6000505;"Projektas „Vilniaus miesto socialinių paslaugų infrastruktūros tinklo kūrimas ir plėtra asmenims, turintiems proto ir (arba) psichikos negalią“";Y;N;13-DEC-21;13-DEC-21
6000506;"Projektas „Vilniaus miesto socialinių paslaugų infrastruktūros tinklo kūrimas ir plėtra asmenims, turintiems proto ir (arba) psichikos negalią“";Y;N;13-DEC-21;13-DEC-21
6000507;"Vilniaus Antakalnio vaikų socialinės globos namų COVID-19 išlaidų padengimas (01)";Y;N;19-FEB-21;19-FEB-21
6000508;"Tikslinės lėšos Vilniaus Antakalnio vaikų socialinės globos namų išlaikymui";Y;N;19-MAY-20;19-MAY-20
6000509;"Tikslinės lėšos Vilniaus vaikų socialinės globos namų „Gilė“ išlaikymui";Y;N;19-MAY-20;19-MAY-20
6000510;"Fabijoniškių pensiono išlaikymas (Tarpusavio atsiskaitymai)";Y;N;20-NOV-07;27-DEC-19
6000511;"VšĮ Vilniaus miesto klinikinės ligoninės medicininės įrangos įsigijimas (Savivaldybės biudžeto lėšos)";Y;N;30-SEP-14;30-SEP-14
6000512;"MMA didinimui";Y;N;26-OCT-15;02-JUN-17
6000513;"MMA didinimui ir darbo apmokėjimo įstatymui įgyvendinti";Y;N;26-OCT-15;02-JUN-17
6000514;"MMA didinimui ir darbo apmokėjimo įstatymui įgyvendinti";Y;N;26-OCT-15;02-JUN-17
6000515;"MMA didinimui ir darbo apmokėjimo įstatymui įgyvendinti";Y;N;26-OCT-15;02-JUN-17
6000516;"MMA didinimui ir darbo apmokėjimo įstatymui įgyvendinti";Y;N;26-OCT-15;02-JUN-17
6000517;"MMA didinimui ir darbo apmokėjimo įstatymui įgyvendinti";Y;N;26-OCT-15;02-JUN-17
6000518;"MMA didinimui ir darbo apmokėjimo įstatymui įgyvendinti";Y;N;26-OCT-15;02-JUN-17
6000519;"MMA didinimui ir darbo apmokėjimo įstatymui įgyvendinti";Y;N;26-OCT-15;02-JUN-17
6000520;"Vilniaus miesto motinos ir vaiko pensiono išlaikymas (Tarpusavio atsiskaitymai)";Y;N;20-NOV-07;16-APR-12
6000521;"Vilniaus Minties vaikų socialinės globos namų išlaikymas (Valstybės biudžetas)";Y;N;16-APR-12;16-APR-12
6000522;"Vilniaus Antakalnio vaikų socialinės globos namų išlaikymas (Valstybės biudžetas)";Y;N;16-APR-12;16-APR-12
6000523;"Vilniaus vaikų socialinės globos namų „Gilė“ išlaikymas (Valstybės biudžetas)";Y;N;16-APR-12;16-APR-12
6000524;"Gerovės konsultantų modelio įdiegimas Vilniaus mieste";Y;N;18-JAN-22;18-JAN-22
6000525;"Gerovės konsultantų modelio įdiegimas Vilniaus mieste";Y;N;18-JAN-22;18-JAN-22
6000530;"Vilniaus miesto nakvynės namų išlaikymas (Tarpusavio atsiskaitymai)";Y;N;20-NOV-07;16-APR-12
6000531;"Vilniaus miesto vaikų ir jaunimo pensiono išlaikymas (Valstybės biudžetas)";Y;N;16-APR-12;16-APR-12
