KODAS;PAVADINIMAS;GALIOJA;SUMINE;SUKURIMO_DATA;MODIFIKAVIMO_DATA
0000000;Nedetalizuojama;Y;N;19-NOV-07;28-JAN-21
1000000;"Administracijos sąmatos";Y;Y;20-NOV-07;29-SEP-09
1000001;"Bendrų ekonominių ir socialinių planavimo paslaugų administravimas ir valdymas";Y;N;14-MAR-08;27-DEC-19
1000002;"Savivaldos institucijos (Taryba)";Y;N;14-MAR-08;25-OCT-21
1000003;"Bendrų ekonominių ir socialinių planavimo paslaugų administravimas ir valdymas";Y;N;14-MAR-08;27-DEC-19
1000004;"Civilinės būklės aktų registravimas";Y;N;14-MAR-08;14-MAR-08
1000005;"Valstybės garantijų nuomininkams, išsikeliantiems iš savininkams grąžintų gyvenamųjų namų ar jų dalių ir butų, vykdymas";Y;N;14-MAR-08;08-FEB-11
1000006;"Nuosavybės teisių atkūrimo sprendimų priėmimas";Y;N;14-MAR-08;14-MAR-08
1000007;"Gyventojų gyvenamosios vietos deklaravimo duomenų ir gyvanamosios vietos neturinčių asmenų apskaitos duomenų tvarkymas";Y;N;14-MAR-08;20-MAR-09
1000008;"Valstybinės kalbos priežiūra";Y;N;14-MAR-08;20-FEB-17
1000009;"Valstybės archyvų irregistrų išlaikymas bei saugojimas";Y;N;14-MAR-08;20-FEB-17
1000010;"Savivaldos institucijos (Tarybos sekretoriatas)";Y;N;20-NOV-07;20-FEB-17
1000011;"Karo prievolės ir mobilizacijos administravimas savivaldybėse";Y;N;14-MAR-08;14-MAR-08
1000012;"Kitos jokiai grupei nepriskirtos bendros valstybės paslaugos (Kitos išlaidos)";Y;N;14-MAR-08;27-DEC-19
1000013;"Kompiuterių ir duomenų apdorojimo tarnybų paslaugos (""KIS Savivaldybė"")";Y;N;14-MAR-08;14-MAR-08
1000014;"Bendri darbo reikalai, darbo politikos formavimas ir įgyvendinimas (Viešieji darbai)";Y;N;14-MAR-08;20-FEB-17
1000015;"Bendrų ekonominių ir socialinių planavimo paslaugų administravimas ir valdymas";Y;N;14-MAR-08;22-FEB-18
1000016;"Kompensacijų administravimas";Y;N;31-DEC-08;25-AUG-10
1000017;"Pirminė teisinė pagalba";Y;N;14-MAR-08;20-FEB-17
1000018;"Kitos bendros valstybės paslaugos (Administracijos direktoriaus rezervas)";Y;N;17-JUN-08;01-JUL-11
1000019;"Administracijos direktoriaus rezervas";Y;N;14-MAR-08;29-JUN-10
1000020;"LR finansų ministerijos 200 -  -   tarpusavio atsiskaitymai Nr.       kompensacijoms už išperkamą nekilnojamąjį turtą religinėms bendrijoms išmokėti (vykdant LRV 200 -  -   nutarimą Nr.    )";Y;N;20-NOV-07;28-OCT-13
1000021;"LR finansų ministerijos 200 -  -   tarpusavio atsiskaitymai Nr.       valstybės garantijoms nuomininkams, gyvenantiems savininkams grąžintinuose gyvenamuose namuose, jų dalyse, butuose, vykdyti (vykdant LRV 200 -  -   nutarimą Nr.    )";Y;N;14-MAR-08;25-AUG-10
1000022;"Valstybės archyvų ir registrų išlaikymas bei saugojimas (LR gyventojų registro įstatymu priskirto LR gyventojų registro tvarkymas ir duomenų teikimas valstybės registrui)";Y;N;14-MAR-08;20-FEB-17
1000023;"Kitos jokiai grupei nepriskirtos bendros valstybės paslaugos (Savivaldybės administracijos darbuotojų mokymo programa)";Y;N;14-MAR-08;20-FEB-17
1000024;"Rinkėjų registravimas, rinkimų ir referendumų rengimas";Y;N;14-MAR-08;14-MAR-08
1000025;"Centrinės institucijos išlaikymas (Žemės ūkio klausimų koordinavimas)";Y;N;14-MAR-08;20-FEB-17
1000026;"LR finansų ministerijos 200 -  -   tarpusavio atsiskaitymai Nr.      savininkams už išperkamus gyvenamuosius namus, jų dalis, butus atlyginti (vykdant LRV 200 -  -   nutarimas Nr.    )";Y;N;14-MAR-08;28-OCT-13
1000027;"Karo prievolės ir mobilizacijos administravimas savivaldybėse (mobilizacija)";Y;N;14-MAR-08;20-FEB-17
1000028;"Civilinės gynybos reikalų ir paslaugų administravimas";Y;N;14-MAR-08;20-FEB-17
1000029;"Civilinės būklės aktų registravimas";Y;N;19-MAR-08;19-MAR-08
1000030;"Duomenų apie suteiktą valstybės pagalbą teikimas valstybės pagalbos registrui";Y;N;20-NOV-07;20-FEB-17
1000031;"Bendrų ekonominių ir socialinių planavimo paslaugų administravimas ir valdymas (Finansų departamentas)";Y;N;14-MAR-08;27-DEC-19
1000032;"Savivaldybei priskirtos valstybinės žemės ir kito valstybės turto valdymas, naudojimas ir disponavimas juo patikėjimo teise";Y;N;14-MAR-08;01-JUL-11
1000033;"Bendrų ekonominių ir socialinių planavimo paslaugų administravimas ir valdymas (Miesto plėtros departamentas)";Y;N;14-MAR-08;04-NOV-21
1000034;"Centrinės institucijos išlaikymas (Miesto ūkio departamentas)";Y;N;14-MAR-08;04-NOV-21
1000035;"Žmogaus teisių apsauga (Vaikų teisių apsaugos tarnyba)";Y;N;14-MAR-08;01-JUL-11
1000036;"Žmogaus teisių apsauga (Vaikų teisių apsaugos tarnyba)";Y;N;14-MAR-08;20-FEB-17
1000037;"Centrinės institucijos išlaikymas (Sveikatos skyrius)";Y;N;14-MAR-08;27-DEC-19
1000038;"Centrinės institucijos išlaikymas (Socialinių reikalų departamentas)";Y;N;14-MAR-08;27-DEC-19
1000039;"Socialinių pašalpų ir išmokų administravimas";Y;N;14-MAR-08;27-DEC-19
1000040;"Žmogaus teisių apsauga (Kultūros ir ugdymo departamentas)";Y;N;20-NOV-07;01-JUL-11
1000041;"Centrinės institucijos išlaikymas (Kultūros ir ugdymo departamentas)";Y;N;14-MAR-08;27-DEC-19
1000042;"Centrinės institucijos išlaikymas (Kultūros ir ugdymo departamentas)";Y;N;14-MAR-08;27-DEC-19
1000043;"Žemės ūkio funkcijų vykdymas";Y;N;25-JAN-10;20-FEB-17
1000044;"Departamentų mokesčiai";Y;N;25-JAN-10;09-MAR-10
1000045;"Visuomenės informavimo priemonių parengimas (AD 2010-10-29 įsakymas Nr. 30-1944)";Y;N;15-NOV-10;15-NOV-10
1000046;"Kitos aplinkos teršimo mažinimo priemonės";Y;N;14-MAR-08;23-MAR-09
1000047;"Kitos aplinkos teršimo mažinimo priemonės";Y;N;14-MAR-08;23-MAR-09
1000048;"Kitos aplinkos teršimo mažinimo priemonės";Y;N;14-MAR-08;23-MAR-09
1000049;"Socialinių išmokų ir kompensacijų administravimas (Socialinių išmokų skyrius)";Y;N;13-JUL-11;27-JAN-14
1000050;Nenaudojama;Y;N;20-NOV-07;19-SEP-19
1000051;"Kompiuterių ir duomenų apdorojimo tarnybos paslaugos (KIS ""Savivaldybė""). Administracijos direktoriaus rezervas";Y;N;17-JUN-08;27-JAN-14
1000052;"LR finansų ministerijos tarpusavio atsiskaitymai";Y;N;14-MAR-08;11-JAN-12
1000053;"Centrinės institucijos išlaikymas (Socialinės globos teikimo asmenims su sunkia negalia paslaugos administravimas)";Y;N;14-MAR-08;20-FEB-17
1000054;"Gyventojų gyvenamosios vietos deklaravimo duomenų ir gyvanamosios vietos neturinčių asmenų apskaitos duomenų tvarkymas";Y;N;14-MAR-08;23-MAR-09
1000055;"Bendri darbo reikalai, darbo politikos formavimas ir įgyvendinimas (Viešųjų darbų administravimas)";Y;N;19-MAR-08;20-FEB-17
1000056;"Bendrų ekonominių ir socialinių planavimo paslaugų administravimas ir valdymas (Turto departamentas)";Y;N;14-MAR-08;19-SEP-19
1000057;"Centrinės institucijos išlaikymas (Socialinės paramos mokiniams administravimas)";Y;N;14-MAR-08;01-DEC-20
1000058;"Bendri darbo reikalai, darbo politikos formavimas ir įgyvendinimas (Neįgaliųjų socialinė integracija)";Y;N;14-MAR-08;14-MAR-08
1000059;"Gyventojų gyvenamosios vietos deklaravimo duomenų ir gyvanamosios vietos neturinčių asmenų apskaitos duomenų tvarkymas";Y;N;14-MAR-08;23-MAR-09
1000060;"Bendrų ekonominių ir socialinių planavimo paslaugų administravimas ir valdymas";Y;N;20-NOV-07;23-MAR-09
1000061;"Institucijos valdymo išlaidos  (Inovacijų ir technologijų grupė, Klientų aptarnavimo skyrius)";Y;N;17-DEC-08;19-SEP-19
1000062;"Institucijos valdymo išlaidos (Administracinės veiklos skyrius, Administracinių bylų nagrinėjimo skyrius, Administracinių nusižengimų tyrimo skyrius, Viešosios tvarkos skyrius). Darbo užmokestis";Y;N;18-DEC-08;27-DEC-19
1000063;"Institucijos valdymo išlaidos (Mero fondas)";Y;N;15-MAY-09;27-DEC-19
1000064;"Finansų valdymo ir apskaitos sistema";Y;N;30-SEP-09;30-SEP-09
1000065;"Bendruomenių kalėdinių ir naujametinių renginių organizavimas seniūnijose (AD 2009-12-14 įsakymas Nr. 30-2172)";Y;N;16-DEC-09;16-DEC-09
1000066;"Vilniaus miesto savivaldybės administracijos tipinių veiklos procesų ir procedūrų visapusiškas tyrimas ir optimizavimas";Y;N;10-FEB-10;10-FEB-10
1000067;"Kompleksinis paslaugų teikimo „vieno langelio“ principu  tobulinimas";Y;N;10-FEB-10;10-FEB-10
1000068;"Vilniaus apskrities vyriausiojo policijos komisariato Patrulių rinktinės pareigūnų skatinimas (AD 2010-03-04 įsakymas Nr. 30-486)";Y;N;08-MAR-10;08-MAR-10
1000069;"Kitos jokiai grupei nepriskirtos bendros valstybės paslaugos (Tarptautinių organizacijų ir LSA nario mokesčiai)";Y;N;07-JAN-19;07-JAN-19
1000070;Nenaudojama;Y;N;20-NOV-07;27-DEC-19
1000071;"Kitos jokiai grupei nepriskirtos bendros valstybės paslaugos (Rinkodaros ir komunikacijos skyriaus kitos išlaidos)";Y;N;07-JAN-19;07-JAN-19
1000072;"Viešosios tvarkos ir visuomenės saugumo mieste užtikrinimas (AD 2010-05-18 įsakymas Nr. 30-1128)";Y;N;19-MAY-10;19-MAY-10
1000073;"Administracinio pastato remonto darbai (AD 2010-10-29 įsakymas Nr. 30-1944)";Y;N;15-NOV-10;15-NOV-10
1000074;"Renginio „Jonui Jablonskiui-150“ organizavimas (AD 2010-11-30 įsakymas Nr. 30-2086)";Y;N;06-DEC-10;06-DEC-10
1000075;"Elektroninių paslaugų sistemos diegimas ir plėtra Vilniaus regione";Y;N;02-MAR-11;02-MAR-11
1000076;"2010-2011 metų nelegalių grafitų prevencijos Vilniaus miesto savivaldybėje programos įgyvendinimas (AD 2011-04-21 įsakymas Nr. 30-648)";Y;N;02-MAY-11;02-MAY-11
1000077;"Saugaus miesto departamento veiklos vykdymas (AD 2011-06-30 įsakymas Nr. 30-891)";Y;N;07-JUL-11;07-JUL-11
1000078;"Socialinių išmokų ir kompensacijų administravimas";Y;N;13-JUL-11;13-JUL-11
1000079;"Socialinių išmokų ir kompensacijų administravimas (LRV 2011-08-17 nutarimas Nr. 960)";Y;N;01-SEP-11;01-SEP-11
1000080;Nenaudojama;Y;N;20-NOV-07;03-NOV-11
1000081;"Socialinių išmokų ir kompensacijų administravimas (LRV 2011-10-19 nutarimas Nr. 1207)";Y;N;03-NOV-11;03-NOV-11
1000082;"Vilniaus apskrities priešgaisrinės gelbėjimo valdybos technikos eksploatavimo išlaidų padengimas ir prevencinio projekto „Saugokite namus nuo gaisrų“ įgyvendinimas (AD 2011-12-06 įsakymas Nr. 30-1745)";Y;N;15-DEC-11;15-DEC-11
1000083;"Viešosios tvarkos užtikrinimas  Vilniaus mieste (AD 2011-11-16 įsakymas Nr. 30-1636)";Y;N;17-NOV-11;17-NOV-11
1000084;"Elektroninio švietimo sistemos diegimas";Y;N;21-NOV-11;21-NOV-11
1000085;"Apdovanojimų įteikimo ceremonijos išlaidų apmokėjimas (AD 2011-12-20 įsakymas Nr. 30-1860)";Y;N;28-DEC-11;28-DEC-11
1000086;"Projekto „Gyvenkime saikingai ir atsakingai“ įgyvendinimas (AD 2011-12-20 įsakymas Nr. 30-1860)";Y;N;28-DEC-11;28-DEC-11
1000087;"Viešosios įstaigos „Žaliosios idėjos“ veiklos vykdymas (AD 2011-12-20 įsakymas Nr. 30-1860)";Y;N;28-DEC-11;28-DEC-11
1000088;"Projekto „EkoRaštis“  įgyvendinimas (AD 2011-12-21 įsakymas Nr. 30-1869)";Y;N;28-DEC-11;28-DEC-11
1000089;"Gyvybės draudimo, draudimo nuo nelaimingų atsitikimų ir sveikatos draudimo paslaugų pirkimas (AD 2011-12-28 įsakymas Nr. 30-1901)";Y;N;28-DEC-11;28-DEC-11
1000090;Nenaudojama;Y;N;20-NOV-07;19-FEB-16
1000091;"Vilniaus miesto jaunimo reikalų tarybos ir jos renginių, Lietuvos moksleivių parlamento veiklos finansavimas";Y;N;28-FEB-12;28-FEB-12
1000092;"Vilniaus miesto jaunimo organizacijų inkubatoriaus renginių, mokymų finansavimas";Y;N;28-FEB-12;28-FEB-12
1000093;"Informavimo programų finansavimas";Y;N;28-FEB-12;28-FEB-12
1000094;"Jaunimo politikos efektyvaus įgyvendinimo strategijos Vilniaus mieste parengimas";Y;N;28-FEB-12;28-FEB-12
1000095;"Projekto „Pasaulio lietuvių jaunimo susitikimas“  įgyvendinimas (AD 2012-04-20 įsakymas Nr. 30-750)";Y;N;04-MAY-12;04-MAY-12
1000096;"Socialinės reabilitacijos paslaugų neįgaliesiems bendruomenėje projektų administravimas";Y;N;21-JUN-12;21-JUN-12
1000097;"Jaunimo atvirų centrų steigimo ir veiklos finansavimas";Y;N;17-SEP-12;17-SEP-12
1000098;"Valstybės garantuojamos pirminės teisinės pagalbos teikimas";Y;N;30-JAN-13;20-FEB-17
1000099;"Valstybinės kalbos vartojimo ir taisyklingumo kontrolė";Y;N;01-DEC-15;20-FEB-17
1000100;Nenaudojama;Y;N;20-NOV-07;19-SEP-19
1000101;"Išmokų vaikams administravimas (Finansų ir ekonomikos skyrius, Apskaitos skyrius)";Y;N;27-JAN-14;19-SEP-19
1000102;"Vienkartinių kompensacijų asmenims, sužalotiems atliekant būtinąją karinę tarnybą sovietinėje armijoje, ir šioje armijoje žuvusiųjų šeimoms administravimas (Finansų ir strateginio planavimo departamentas)";Y;N;01-FEB-16;14-NOV-16
1000103;"Vienkartinių pašalpų ginkluoto pasipriešinimo (rezistencijos) dalyviams – kariams savanoriams, administravimas (Finansų ir strateginio planavimo departamentas)";Y;N;01-FEB-16;14-NOV-16
1000104;"Projekto „Neformaliojo vaikų švietimo paslaugų plėtra“ įgyvendinimas (ES paramos lėšos (dotacijos))";Y;N;09-NOV-16;09-NOV-16
1000105;"Dėl ekonomikos krizės  neproporcingai sumažinto darbo užmokesčio (atlyginimo) dalies grąžinimas";Y;N;08-FEB-17;08-FEB-17
1000106;"Neveiksnių asmenų būklės peržiūrėjimo užtikrinimas";Y;N;08-FEB-17;08-FEB-17
1000107;"Savivaldybėms priskirtų archyvinių dokumentų tvarkymas";Y;N;22-FEB-17;22-FEB-17
1000108;"Dalyvavimas rengiant ir įgyvendinant darbo rinkos politikos priemones ir gyventojų užimtumo programas (Viešieji darbai)";Y;N;23-FEB-17;23-FEB-17
1000109;"Dalyvavimas rengiant ir įgyvendinant darbo rinkos politikos priemones ir gyventojų užimtumo programas (Užimtumo didinimo programa)";Y;N;10-NOV-17;10-NOV-17
1000110;Nenaudojama;Y;N;20-NOV-07;10-NOV-17
1000111;"Socialinės reabilitacijos paslaugų neįgaliesiems bendruomenėje projektų administravimas";Y;N;22-FEB-18;22-FEB-18
1000115;"Dėl ekonomikos krizės neproporcingai sumažinto darbo užmokesčio (atlyginimo) dalies grąžinimas (20 proc.)";Y;N;22-FEB-18;22-FEB-18
1000116;"Koordinuotai teikiamų paslaugų vaikams nuo gimimo iki 18 metų (turintiems didelių ir labai didelių specialiųjų ugdymosi poreikių – iki 21 metų) ir vaiko atstovams koordinavimas";Y;N;07-MAR-18;29-JAN-21
1000117;"Institucijos valdymo išlaidos (Tarpinstitucinio bendradarbiavimo koordinavimo skyrius)";Y;N;02-JUL-18;02-JUL-18
1000118;"Institucijos valdymo išlaidos (Administracija). Kitos išlaidos";Y;N;31-DEC-19;31-DEC-19
1000119;"Institucijos valdymo išlaidos (Seniūnijos). Kitos išlaidos";Y;N;31-DEC-19;31-DEC-19
1000120;Nenaudojama;Y;N;20-NOV-07;31-DEC-19
1000121;"Institucijos valdymo išlaidos (Miesto planavimo ir architektūros, Miestovaizdžio, Kultūros paveldo apsaugos, Statybos reglamentavimo, Teritorijų planavimo ir plėtros projektų, Žemės tvarkymo ir administravimo skyriai). Kitos išlaidos";Y;N;31-DEC-19;04-NOV-21
1000122;"Institucijos valdymo išlaidos (Infrastruktūros skyrius, Būsto administravimo skyrius, Eismo organizavimo skyrius, Energetikos skyrius, Miesto tvarkymo ir aplinkos apsaugos skyrius). Kitos išlaidos";Y;N;31-DEC-19;04-NOV-21
1000123;"Institucijos valdymo išlaidos (Sveikatos apsaugos skyrius). Kitos išlaidos";Y;N;31-DEC-19;31-DEC-19
1000124;"Institucijos valdymo išlaidos (Socialinių paslaugų skyrius). Kitos išlaidos";Y;N;31-DEC-19;31-DEC-19
1000125;"Institucijos valdymo išlaidos (Kultūros skyrius, Sporto ir sveikatingumo skyrius). Kitos išlaidos";Y;N;31-DEC-19;31-DEC-19
1000126;"Institucijos valdymo išlaidos (Švietimo aplinkos skyrius, Bendrojo ugdymo skyrius, Ikimokyklinio ugdymo skyrius). Kitos išlaidos";Y;N;31-DEC-19;31-DEC-19
1000127;"Institucijos valdymo išlaidos (Administracinės veiklos skyrius, Administracinių bylų nagrinėjimo skyrius, Administracinių nusižengimų tyrimo skyrius, Viešosios tvarkos skyrius). Kitos išlaidos";Y;N;31-DEC-19;31-DEC-19
1000128;"Dalyvavimas rengiant ir vykdant mobilizaciją";Y;N;31-DEC-19;31-DEC-19
1000129;"Civilinė sauga";Y;N;31-DEC-19;31-DEC-19
1000130;Nenaudojama;Y;N;20-NOV-07;31-DEC-19
1000131;"Koordinuotai teikiamų paslaugų vaikams nuo gimimo iki 18 metų (turintiems didelių ir labai didelių specialiųjų ugdymosi poreikių – iki 21 metų) ir vaiko atstovams koordinavimas";Y;N;31-DEC-19;29-JAN-21
1000132;"Bendruomenių patalpų išlaikymo išlaidos";Y;N;31-DEC-19;31-DEC-19
1000133;"Seniūnaičių veiklos finansavimas";Y;N;31-DEC-19;31-DEC-19
1000134;"Socialinių išmokų ir kompensacijų administravimas";Y;N;22-JAN-20;22-JAN-20
1000135;"Ekstremalių situacijų likvidavimas";Y;N;19-MAR-20;19-MAR-20
1000136;"Vienkartinės išmokos vaikams administravimas (finansavimo šaltinis 1.1.1.1.5)";Y;N;27-JUL-20;27-JUL-20
1000137;"Vienkartinės išmokos vaikams administravimas (finansavimo šaltinis 1.1.1.1.1)";Y;N;27-JUL-20;27-JUL-20
1000138;"Išlaidų, patirtų siekiant šalinti COVID-19 ligos (koronaviruso infekcijos) padarinius ir valdyti jos plitimą esant valstybės lygio ekstremaliajai situacijai, kompensavimas";Y;N;07-SEP-20;07-SEP-20
1000139;"Socialinės paramos mokiniams administravimas (Socialinių išmokų skyrius)";Y;N;01-DEC-20;01-DEC-20
1000140;Nenaudojama;Y;N;20-NOV-07;29-JAN-21
1000141;"Akredituotos vaikų dienos socialinės priežiūros administravimas";Y;N;29-JAN-21;29-JAN-21
1000142;"Išlaidų, susijusių su mobiliųjų COVID-19 testavimo punktų įrengimu ir darbo juose organizavimu, kompensavimas";Y;N;28-DEC-21;28-DEC-21
1000143;"Socialinės reabilitacijos paslaugų neįgaliesiems bendruomenėje projektų administravimas";Y;N;01-FEB-22;01-FEB-22
1000144;"Globos (rūpybos) išmokai ir globos (rūpybos) išmokos tiksliniam priedui padidintai daliai administruoti";Y;N;17-MAR-22;17-MAR-22
1000145;"Bendruomeninės veiklos savivaldybėje įgyvendinant bandomąjį modelį administravimas";Y;N;28-APR-22;06-JUN-22
1000146;"Bendruomeninės veiklos savivaldybėje kuriant palankią daugiakultūrę aplinką administravimas";Y;N;28-APR-22;28-APR-22
1000147;"Paramos užsieniečiams (vienkartinių išmokų įsikurti ir kompensacijų už vaikų ugdymą) administravimas";Y;N;30-MAY-22;30-MAY-22
1000150;Nenaudojama;Y;N;20-NOV-07;13-FEB-13
1000151;"Tėvų mokesčio surinkimas jaunimo politiką  įgyvendinančiose įstaigose";Y;N;13-FEB-13;13-FEB-13
1000152;"Išlaidų, susijusių su minimalios algos padidėjimu, finansavimas";Y;N;07-NOV-16;07-NOV-16
1000153;"Įstaigų darbuotojų darbo apmokėjimo įstatymui laipsniškai įgyvendinti (tarpusavio atsiskaitymai)";Y;N;06-JUN-17;06-JUN-17
1000154;"Neformalaus ugdymo įstaigų veiklos finansavimas ir plėtra (69 šalt.)";Y;N;21-FEB-19;21-FEB-19
1000155;"Neformalaus ugdymo įstaigų veiklos finansavimas ir plėtra (SB)";Y;N;20-JAN-17;20-JAN-17
1000156;"Tėvų mokesčio surinkimas neformaliojo švietimo įstaigose";Y;N;25-JAN-17;25-JAN-17
1000157;"Neformalaus ugdymo įstaigų veiklos finansavimas ir plėtra (tarpusavio atsiskaitymai)";Y;N;02-FEB-17;02-FEB-17
1000158;"Tėvų mokesčio surinkimas neformaliojo švietimo įstaigose";Y;N;28-MAR-17;28-MAR-17
1000159;"Papildomas lėšų gavimas už patalpų nuomą ugdymo įstaigose";Y;N;28-MAR-17;28-MAR-17
1000160;Nenaudojama;Y;N;20-NOV-07;28-MAR-17
1000161;"Papildomas lėšų gavimas nuomojant patalpas";Y;N;06-APR-17;06-APR-17
1000162;"Mokamų paslaugų  neformaliojo švietimo įstaigose teikimas";Y;N;24-MAY-17;24-MAY-17
1000163;"Įstaigų darbuotojų darbo apmokėjimo įstatymui laipsniškai įgyvendinti (tarpusavio atsiskaitymai)";Y;N;24-MAY-17;24-MAY-17
1000164;"Moksleivių pilietiškumo ir savivaldos ugdymas (SB)";Y;N;20-SEP-17;20-SEP-17
1000165;"Neformaliojo vaikų švietimo 15 eurų krepšelio lėšos (SB)";Y;N;02-NOV-17;02-NOV-17
1000166;"Neformaliojo vaikų švietimo 15 eurų krepšelio lėšos (ES)";Y;N;12-JAN-18;12-JAN-18
1000167;"Tyrimų, galimybių studijų ir analizių finansavimas";Y;N;22-FEB-18;22-FEB-18
1000168;"NVŠ jaunimo centro „Mes“ 15 Eur krepšelio lėšos";Y;N;12-OCT-18;12-OCT-18
1000169;"Jaunimo centro „Mes“ lėšų likučiai iš biudžetinių įstaigų pajamų įmokų už paslaugas";Y;N;12-OCT-18;12-OCT-18
1010001;"Civilinės metrikacijos skyrius";Y;N;15-MAR-08;15-MAR-08
1010002;"Poilsio namai ""Jūros vilnis""";Y;N;15-MAR-08;15-MAR-08
1010003;Administracija;Y;N;15-MAR-08;15-MAR-08
1010007;"Fabijoniškių seniūnija";Y;N;15-MAR-08;15-MAR-08
1010010;"Rasų seniūnija";Y;N;15-MAR-08;15-MAR-08
1010020;"Lazdynų turgavietės eksploatavimas";Y;N;22-OCT-09;22-OCT-09
1010501;"Kompiuterinė technika ir orgtechnika";Y;N;19-MAR-08;19-MAR-08
1010502;"Geografinės informacijos sistemų integracija";Y;N;14-MAR-08;14-MAR-08
1010503;"Elektroninio bilieto viešajame transporte ir keleivių informavimo sistemos sukūrimas";Y;N;14-MAR-08;14-MAR-08
1010504;"Elektroninio švietimo sistemos diegimas";Y;N;14-MAR-08;14-MAR-08
1010505;"Elektroninės sveikatos informacinė sistema";Y;N;14-MAR-08;14-MAR-08
1010506;"Finansų valdymo ir apskaitos sistema";Y;N;14-MAR-08;14-MAR-08
1010519;"Pastato V. A. Graičiūno g. 20, Vilniuje, remontas (Privatizavimo fondas)";Y;N;29-JUN-15;29-JUN-15
1010520;"Archyvinių dokumentų saugojimas (Privatizavimo fondas)";Y;N;04-FEB-15;04-FEB-15
1010521;"Savivaldybės turto privatizavimo funkcijų vykdymas";Y;N;14-MAR-08;10-OCT-11
1010522;"Bendruomenės centrų steigimas Vilniaus miesto savivaldybės administracijos seniūnijose (Grigiškių seniūnija)";Y;N;14-MAR-08;14-MAR-08
1010523;"Bendruomenės centrų steigimas Vilniaus miesto savivaldybės administracijos seniūnijose (Naujininkų seniūnija)";Y;N;14-MAR-08;14-MAR-08
1010524;"Bendruomenės centrų steigimas Vilniaus miesto savivaldybės administracijos seniūnijose (Naujosios Vilnios seniūnija)";Y;N;14-MAR-08;14-MAR-08
1010525;"Bendruomenės centrų steigimas Vilniaus miesto savivaldybės administracijos seniūnijose (Panerių seniūnija)";Y;N;14-MAR-08;14-MAR-08
1010526;"Bendruomenės centrų steigimas Vilniaus miesto savivaldybės administracijos seniūnijose (Pavilnio bendruomenės savivaldija)";Y;N;14-MAR-08;14-MAR-08
1010527;"Bendruomenės centrų steigimas Vilniaus miesto savivaldybės administracijos seniūnijose (Pilaitės seniūnija)";Y;N;14-MAR-08;14-MAR-08
1010528;"Bendruomenės centrų steigimas Vilniaus miesto savivaldybės administracijos seniūnijose (Šeškinės seniūnija)";Y;N;14-MAR-08;14-MAR-08
1010529;"Bendruomenės centrų steigimas Vilniaus miesto savivaldybės administracijos seniūnijose (Verkių seniūnija)";Y;N;14-MAR-08;14-MAR-08
1010530;"Bendruomenės centrų steigimas Vilniaus miesto savivaldybės administracijos seniūnijose (Žvėryno seniūnija)";Y;N;14-MAR-08;14-MAR-08
1010531;"Bendruomenės centrų steigimas seniūnijose (Lazdynų seniūnija)";Y;N;17-JUN-08;17-JUN-08
1010541;"Elektroninės sveikatos informacinė sistema";Y;N;14-MAR-08;14-MAR-08
1010542;"Elektroninio švietimo sistemos diegimas";Y;N;14-MAR-08;14-MAR-08
1010543;"Kompiuterinė įranga ir orgtechnika (skolintos )";Y;N;17-JUN-08;17-JUN-08
1010544;"Elektroninio bilieto viešajame transporte ir keleivių informavimo sistemos sukūrimas";Y;N;17-DEC-08;17-DEC-08
1010545;"Aplinkos apsaugos optimizavimas elektroninėmis priemonėmis";Y;N;17-DEC-08;17-DEC-08
1010546;"Finansų valdymo ir apskaitos sistema";Y;N;17-DEC-08;17-DEC-08
1010551;"Fabijoniškių seniūnija (gyvūnų laikymo lėšos)";Y;N;14-MAR-08;14-MAR-08
1010552;"Rasų seniūnija (gyvūnų laikymo lėšos)";Y;N;14-MAR-08;07-APR-10
1010553;"Verkių seniūnija (gyvūnų laikymo lėšos)";Y;N;14-MAR-08;14-MAR-08
1010554;"Žirmūnų seniūnija (gyvūnų laikymo lėšos)";Y;N;14-MAR-08;14-MAR-08
1010561;"Karoliniškių seniūnija (Parama)";Y;N;14-MAR-08;14-MAR-08
1010562;"Fabijoniškių seniūnija (Parama)";Y;N;14-MAR-08;14-MAR-08
1010563;"Grigiškių seniūnija (Parama)";Y;N;14-MAR-08;14-MAR-08
1010564;"Lazdynų seniūnija (Parama)";Y;N;14-MAR-08;14-MAR-08
1010565;"Naujininkų seniūnija (Parama)";Y;N;14-MAR-08;14-MAR-08
1010566;"Pilaitės seniūnija (Parama)";Y;N;14-MAR-08;14-MAR-08
1010567;"Šeškinės seniūnija (Parama)";Y;N;14-MAR-08;14-MAR-08
1010568;"Šnipiškių seniūnija (Parama)";Y;N;14-MAR-08;14-MAR-08
1010569;"Vilkpėdės seniūnija (Parama)";Y;N;14-MAR-08;14-MAR-08
1010570;"Viršuliškių seniūnija (Parama)";Y;N;14-MAR-08;14-MAR-08
1010571;"Verkių seniūnija (Parama)";Y;N;14-MAR-08;14-MAR-08
1010572;"Žvėryno seniūnija (Parama)";Y;N;14-MAR-08;14-MAR-08
1010573;"Užsienio ryšių skyrius (parama)";Y;N;05-DEC-11;05-DEC-11
1010574;"Civilinės metrikacijos skyrius (Parama)";Y;N;02-SEP-20;02-SEP-20
1010581;"Kitos seniūnijų lėšos";Y;N;14-MAR-08;26-MAR-09
1010591;"Už butus grąžinamas paskola";Y;N;14-MAR-08;27-DEC-19
1010592;"Kitos išlaidos (konkurso lėšos, deponentai)";Y;N;14-MAR-08;14-MAR-08
1010593;"Komandiruočių išlaidų kompensavimas iš projektų lėšų";Y;N;05-DEC-19;27-JAN-20
1010594;"Komandiruočių užsienyje išlaidų kompensavimas";Y;N;11-DEC-19;11-DEC-19
1010600;"ES projektas/ 0037";Y;N;17-JUN-08;17-JUN-08
1010601;"Elektroninio bilieto viešajame transporte ir keleivių informavimo sistemos sukūrimas";Y;N;14-MAR-08;24-SEP-09
1010602;"Elektroninių priemonių skirtų gyventojams dalyvauti sprendimų priėmime sukūrimas ir įdiegimas (E. demokratija)";Y;N;18-FEB-10;18-FEB-10
1010603;"Vilniaus miesto savivaldybės dirbančiųjų kvalifikacijos tobulinimas";Y;N;23-NOV-10;23-NOV-10
1010604;"Vilniaus miesto savivaldybės administracijos darbuotojų gebėjimų tobulinimas diegiant ir plėtojant informacinių technologijų panaudojimą viešajame sektoriuje";Y;N;18-JAN-11;18-JAN-11
1010605;"Vilniaus miesto savivaldybės administracijos tipinių veiklos procesų ir procedūrų visapusiškas tyrimas ir optimizavimas";Y;N;18-JAN-11;18-JAN-11
1010606;"Kompleksinis paslaugų teikimo „vieno langelio“ principu  tobulinimas";Y;N;18-JAN-11;18-JAN-11
1010607;"Dalyvauti ES  lėšomis finansuojamame projekte „BaltMet Promo“";Y;N;12-JUL-11;12-JUL-11
1010608;"Mindaugo vidurinės mokyklos užterštos teritorijos sutvarkymas";Y;N;12-JUL-11;12-JUL-11
1010609;"Vilniaus miesto savivaldybės darbuotojų kvalifikacijos tobulinimas";Y;N;28-JUL-11;28-JUL-11
1010610;"Elektroninių priemonių skirtų gyventojams dalyvauti sprendimų priėmime sukūrimas ir įdiegimas (E. demokratija)";Y;N;18-FEB-10;18-FEB-10
1010611;"Vilniaus miesto savivaldybės darbuotojų administracinių gebėjimų stiprinimas (ES)";Y;N;05-JUN-13;05-JUN-13
